{
  "tab_id": "x",
  "tab_name": "X.com Posts",
  "subtitle": "Social Intelligence",
  "icon": "Twitter",
  "min_items": 15,
  "freshness": {
    "target_pct_new": 0.80,
    "pct_new": 0.94,
    "items_total": 18,
    "items_new": 17,
    "items_returning": 1,
    "empty_week_note": ""
  },
  "executive_summary": [
    {
      "headline": "Anthropic's SpaceX Colossus deal doubles Claude Code rate limits and unlocks 220,000 GPUs within the month",
      "body": "On May 5–6, Anthropic announced it had signed an agreement with SpaceX to use all compute capacity at the Colossus 1 data center in Memphis — over 300 megawatts and 220,000 NVIDIA GPUs — and immediately doubled Claude Code five-hour rate limits for Pro, Max, Team, and seat-based Enterprise plans. The announcement, made at Code with Claude SF 2026, also disclosed that Anthropic's API volume is up 17× year-on-year. Simon Willison's live blog flagged an environmental caveat: the Colossus facility carries a particularly bad environmental record.",
      "primary_url": "https://www.anthropic.com/news/higher-limits-spacex"
    },
    {
      "headline": "Musk v. Altman trial Week 2: xAI distilled OpenAI models, Brockman's journals read in court, safety researcher testifies OpenAI abandoned AI safety",
      "body": "The trial's second week produced three substantive disclosures. Musk confirmed under oath that xAI trained Grok in part by distilling OpenAI models — a practice that violates OpenAI's terms of service. Greg Brockman's personal journals were read into evidence, describing leadership struggles and his relationship with Musk before 2018. Former OpenAI safety researcher Rosie Campbell testified that both long-term AI safety teams at OpenAI were eliminated as the company became product-focused. Closing arguments are scheduled for May 14; jury deliberation is expected to begin around May 18.",
      "primary_url": "https://techcrunch.com/2026/04/30/elon-musk-testifies-that-xai-trained-grok-on-openai-models/"
    },
    {
      "headline": "OpenAI releases GPT-5.5 Instant, three realtime voice models, and B2B Signals — all in one week",
      "body": "GPT-5.5 Instant became the new default ChatGPT model on May 5, replacing GPT-5.3 Instant. OpenAI reported 52.5% fewer hallucinated claims on high-stakes prompts versus its predecessor. On May 7–8, OpenAI released GPT-Realtime-2 (GPT-5-class reasoning in voice, 128K context), GPT-Realtime-Translate (70+ input languages), and GPT-Realtime-Whisper (live streaming transcription) — exiting Realtime API beta. On May 6, OpenAI published B2B Signals, showing frontier firms use 3.5× more AI intelligence per worker than typical firms, with a 16× Codex message gap.",
      "primary_url": "https://openai.com/index/gpt-5-5-instant/"
    },
    {
      "headline": "Claude Managed Agents public beta ships multiagent orchestration, Outcomes, and Dreaming at Code with Claude SF",
      "body": "At Code with Claude SF 2026 (May 6), Anthropic launched three Claude Managed Agents features in public beta or research preview: multiagent orchestration (lead agent delegates to specialist agents on a shared filesystem), Outcomes (success-criterion-driven self-correction loop; +10.1% task success on internal benchmarks), and Dreaming (overnight session review and memory curation; Harvey reported ~6× higher task completion rates). The event also revealed Shopify and Mercado Libre are targeting 90% autonomous coding by Q3 2026.",
      "primary_url": "https://blakecrosley.com/blog/code-with-claude-sf-2026-recap"
    },
    {
      "headline": "Mozilla used Claude Mythos Preview to find 271 security vulnerabilities in Firefox 150, including 180 high-severity bugs",
      "body": "Mozilla published a detailed post-mortem on May 7 showing how it used Claude Mythos Preview and an agentic harness to identify 271 bugs in Firefox 150 — 180 high-severity, 80 moderate, 11 low — including sandbox escapes, a 15-year-old rendering bug, and a 20-year-old XSLT bug. Mozilla credited three CVEs directly to Anthropic. The post is the first major public-sector technical disclosure of Mythos Preview's security capabilities and changes the calculus on AI-assisted vulnerability research for regulated organizations.",
      "primary_url": "https://hacks.mozilla.org/2026/05/behind-the-scenes-hardening-firefox/"
    }
  ],
  "top_picks": [
    {
      "id": "x-anthropic-spacex-colossus-rate-limits",
      "title": "\"We've agreed to a partnership with SpaceX that will substantially increase our compute capacity.\"",
      "subtitle": "Anthropic doubles Claude Code rate limits using SpaceX Colossus 1 — 220,000 GPUs, 300+ MW, effective within the month",
      "source": "@AnthropicAI",
      "author": "Anthropic",
      "date": "2026-05-05",
      "primary_url": "https://www.anthropic.com/news/higher-limits-spacex",
      "secondary_urls": [
        {
          "label": "Code with Claude SF 2026 recap (Blake Crosley)",
          "url": "https://blakecrosley.com/blog/code-with-claude-sf-2026-recap"
        },
        {
          "label": "Simon Willison live blog — environmental caveat noted",
          "url": "https://simonwillison.net/2026/May/6/code-w-claude-2026/"
        }
      ],
      "verified": true,
      "verified_at": "2026-05-06T12:00:00Z",
      "platform": "x",
      "summary": "Anthropic announced on May 5–6 that it had signed an agreement with SpaceX to use all compute capacity at Colossus 1 in Memphis — more than 300 megawatts and over 220,000 NVIDIA GPUs — available within the month. The immediate effect: Claude Code five-hour rate limits doubled for Pro, Max, Team, and seat-based Enterprise plans; peak-hours throttling removed for Pro and Max; Opus API rate limits raised considerably. Anthropic's Colossus partnership sits alongside a 5 GW Amazon deal, a 5 GW Google/Broadcom deal, and a $30B Microsoft/NVIDIA Azure arrangement. Simon Willison flagged during his Code with Claude live blog that the Memphis Colossus facility has a particularly bad environmental record.",
      "engagement": {
        "likes": 4200,
        "shares": 890,
        "comments": 312
      },
      "score": {
        "total": 9.0,
        "signal": 3,
        "novelty": 2,
        "actionability": 2,
        "source_quality": 2
      },
      "tags": ["anthropic", "spacex", "compute", "claude-code", "enterprise", "rate-limits"],
      "category": "Tool Announcement",
      "priority": "CRITICAL",
      "recurrence": "new",
      "key_takeaways": [
        "Claude Code rate limits doubled overnight — enterprise teams hitting the five-hour ceiling should re-evaluate whether previously shelved use cases are now viable.",
        "The compute partnership structure (all five deals combined: Amazon, Google/Broadcom, Microsoft/NVIDIA, SpaceX, Fluidstack) suggests Anthropic is building a multi-cloud, multi-partner infrastructure layer rather than depending on any single hyperscaler.",
        "Anthropic's API volume is up 17× year-on-year, which means pricing and availability terms are likely to shift again before year-end.",
        "Simon Willison's environmental flag on the Colossus data center is worth tracking for organizations with sustainability commitments that govern vendor procurement.",
        "The orbital compute interest — Anthropic's stated intent to develop gigawatts of space-based AI compute with SpaceX — is a long-horizon signal about where inference infrastructure is heading."
      ],
      "suggested_actions": [
        "Retest Claude Code on any multi-hour autonomous coding tasks that were previously throttled — the doubled rate limits may now make weekend-scale agentic runs viable.",
        "If your organization has ESG or sustainability reporting requirements, note the Colossus facility's environmental record before citing Anthropic as a sustainable AI vendor.",
        "Assess whether your current Anthropic contract terms (rate limits, SLA) need to be renegotiated to reflect the new capacity — enterprise contracts set before May 2026 may not have captured the new ceiling."
      ],
      "enterprise_translation": "Consumer signal: individual Claude Pro subscribers can now run Claude Code for twice as long without hitting rate limits, opening up overnight autonomous coding runs. Enterprise concept: the capacity expansion changes the economic model for agentic workflows. Tasks that required human-in-the-loop pacing to manage throttling can now be fully delegated for sustained multi-hour runs. For a regulated enterprise AI team, this means agent governance — not API limits — is now the binding constraint. The governance investment is in eval design, approval gates, and audit logging, not in scheduling around capacity ceilings."
    },
    {
      "id": "x-mozilla-firefox-claude-mythos-271-bugs",
      "title": "\"Behind the Scenes: Hardening Firefox with Claude Mythos Preview\"",
      "subtitle": "Mozilla used an agentic harness + Claude Mythos to find 271 vulnerabilities in Firefox 150 — 180 high-severity, including sandbox escapes and a 20-year-old XSLT bug",
      "source": "@mozilla",
      "author": "Brian Grinstead / Mozilla Security",
      "date": "2026-05-07",
      "primary_url": "https://hacks.mozilla.org/2026/05/behind-the-scenes-hardening-firefox/",
      "secondary_urls": [
        {
          "label": "Simon Willison link-blog note on Mythos/Firefox",
          "url": "https://simonwillison.net/2026/May/7/firefox-claude-mythos/"
        },
        {
          "label": "TechCrunch coverage",
          "url": "https://techcrunch.com/2026/05/07/how-anthropics-mythos-has-rewritten-firefoxs-approach-to-cybersecurity/"
        }
      ],
      "verified": true,
      "verified_at": "2026-05-07T18:00:00Z",
      "platform": "x",